1,Chcesz wziąć udział w turnieju JavaScript? Rejestracja trwa! 27. kwietnia o 18:00 w Browarze Lubicz krakowscy programiści JavaScript wezmą udział w turnieju Yggdrasil Coding Challenge. Udział w konkursie jest darmowy  ale wymagana jest wcześniejsza rejestracja. Zostało jeszcze kilka miejsc. Niech wygra najlepszy! Yggdrasil Coding Challenge to turniej  którego celem jest wyłonienie najlepszego zawodnika – programisty JavaScript. Konkurs  organizowany przez krakowski oddział Yggdrasil  zrywa ze znaną formułą hackathonu  a w zamian proponuje system pucharowy złożony z kilku etapów rywalizacji. Uczestnicy konkursu poznają temat zadań tuż przed rozpoczęciem kolejnych rund kodowania. Uczestnicy będą walczyć o konsolę PlayStation 4 oraz okulary VR. Spotkanie rozpocznie prezentacja na temat animacji 3D. Nie kodujesz? Przyjdź kibicować! Wydarzenie jest otwarte zarówno dla tych  którzy chcą wziąć udział w konkursie jak i zainteresowanych samą prezentacją. Wszyscy  którzy chcą dołączyć do spotkania  powinni potwierdzić swoją obecność dołączając do wydarzenia na Facebooku. Uczestnicy konkursu dodatkowo muszą dokonać rejestracji na meetup.com. W obu przypadkach liczba miejsc jest ograniczona  więc decyduje kolejność zgłoszeń. O Organizatorze Yggdrasil Polska specjalizuje się w tworzeniu gier dla kasyn online. Swoje biura ma już na Malcie  w Sztokholmie i na Gibraltarze. W Krakowie rozwija się centrum technologiczne firmy  którym obecnie pracuje 80 osób. W tym roku spółka zdobyła tytuł Innowatora Roku podczas gali International Gaming Awards w Londynie. To kolejne wyróżnienie po zeszłorocznej wygranej w kategorii Gaming Software Supplier (Dostawca Oprogramowania Dla Branży Kasynowej).,
0, Nowe logowanie z aplikacji Chrome na urządzeniu z systemem Windows Witamy  Ktoś właśnie zalogował się na Twoje konto Google kontakt@knbit.edu.pl w aplikacji Chrome na urządzeniu z systemem Windows. Koło Naukowe BIT kontakt@knbit.edu.pl Windows czwartek  20 kwietnia 2017 18:27 (CET) Polska* Chrome Nie rozpoznajesz tej aktywności? Sprawdź ostatnio używane urządzenia teraz. Dlaczego to wysyłamy? Kwestie bezpieczeństwa traktujemy bardzo poważnie i chcemy informować Cię o wszystkich ważnych działaniach na Twoim koncie. Nie udało nam się ustalić  czy Twoje konto było już wcześniej używane w tej przeglądarce lub na tym urządzeniu. Taka sytuacja może się zdarzyć wtedy  gdy pierwszy raz logujesz się na nowym komputerze  telefonie lub w przeglądarce  używasz w przeglądarce trybu incognito lub przeglądania prywatnego  usuniesz pliki cookie albo gdy na Twoje konto próbuje dostać się ktoś inny. ,
1,Witam serdecznie  W imieniu firmy Capgemini serdecznie zapraszam na spotkanie branżowe IT T@lk. Tematem przewodni to: Jak sprawić  aby rozwiązania IT były używane  czyli Gamifikacja w praktyce. Podczas najbliższego spotkania IT T@lk w Krakowie porozmawiamy o wyzwaniach  jakie pojawiają się podczas wprowadzania zmiany IT w środowisku klienta  o ryzykach z nią związanych oraz o komunikacji w ramach IT. Przedstawimy pomysły na to  jak osiągnać swoje cele związane z wdrażaną aplikacją  podpowiemy jak zmieniać przyzwyczajenia użytkowników i jak angażować ich w rozwój wprowadzanego rozwiązania. Po części merytorycznej przewidujemy czas na poczęstunek oraz networking branżowy. Serdecznie zapraszam na spotkanie członków koła  a także proszę o przekazanie informacji do innych zainteresowanych osób. Poniżej znajdą Państwo link do zapisów: ,
1,Dzień dobry  Czy możliwe będzie rozesłanie informacji o akceleratorze Space3ac do członków Koła Naukowego? Jeśli to możliwe będę wdzięczna za umieszczenie informacji także na stronie Koła i facebooku. Projekt akceleratora przeznaczony jest studentów. Tekst do udostępnienia: Interesujesz się nawigacją satelitarną  obserwacjami Ziemi a może telekomunikacją? Podejmij wyzwanie: dołącz do akceleratora @Space3ac(PROSZE O OZNACZENIA FANPAGE SPACE3ac NA FACEBOOKU) i rozwiąż problemy dużych firm branży transportowej! 20 akcelerowanych projektów otrzyma wsparcie w wysokości 200 000 PLN. Więcej informacji na www.space3.ac Dziękuję za wsparcie. Więcej informacji o projekcie w załączniku i na stronie www.space3.ac ,
1,Witam serdecznie poświątecznie  zapraszamy do zgłaszania prezentacji do sesji Forum MM. Termin nadsyłania zgłoszeń jest przedłużony do 30 kwietnia  tak więc zachęcam do współpracy. Informacje o sesji Forum Młodych Mistrzów wraz z możliwością zgłaszania prezentacji znajdują się pod linkami: http://forumti.pl/?page_id=309 http://rejestracja.forumti.pl/prezentacja ,
0," Hello Google Play Developer  We're continually striving to make Google Play a positive experience for both our developers and our users. In order to do this  we’ve introduced changes to the Developer Distribution Agreement (""DDA"") to make clear that it covers the existing and new services provided to developers through Google Play. Additionally  we have introduced changes that allow us to subtract the developer share of refunds from developer payouts. This includes those refunds issued more than 48 hours after the purchase. This supports our continued emphasis on providing a high quality Play experience for both users and developers  matches customary practices in retail  and aligns our policies with the majority of app and game stores in the industry. This email is to notify you that these DDA changes will be effective starting May 17  2017. No action is required on your part. You can view the updated DDA here. The Google Play user refund policy  which includes information about when we might provide refunds to users  is not affected by this change. To help you maintain a fair ecosystem in your app or game  we recently launched the Voided Purchases API. You can use the API to identify voided purchases and use this information to implement your own clawback strategy for in-app items.",
0,Hi  Your security is very important to us. We noticed that your Cloudflare account was recently accessed from a new IP address: ,
0,Cześć  Chciałbym zapytać  czy sekcja AI jeszcze działa? A jeśli tak  to czy ktoś zupełnie zielony w temacie uczenia maszynowego może dołączyć  czy raczej powinien najpierw coś ogarnąć samodzielnie? Dzięki  Jakub Łanecki ,
1, Dzień dobry  jesteśmy organizacją non profit  która skupia kobiety pracujące nad nowoczesnymi technologiami. Spotykamy się  by lepiej się poznać  wymieniać doświadczeniem  wspólnie się uczyć i wzajemnie wspierać. Inspirujemy się do działania  rozwijamy się  i łamiemy stereotypy – tak by kobiety mogły się rozwijać  osiągać wielkie sukcesy. Pracujemy w wielu miastach w Polsce  w Krakowie  Warszawie  Poznaniu  Lublinie  Katowicach  Opolu  Łodzi  Wrocławiu  Gdańsku. Aktualnie  tworzymy dwa programy: -> Let’s solve IT- together we are unstoppable!  czyli seria krótkich  15  20 i 30 minutowych wideokonferencji 1 na 1  w czasie których będzie można pracować z ekspertami IT nad rozwiązaniem problemu  w którym utknęliśmy. ▸masz IT problem ▸wypełniasz aplikację ▸rozwiązujesz go z ekspertami IT. -> Trzecia edycja programu mentorskiego Tech Leaders Celem projektu jest stworzenie swobodnej przestrzeni do dzielenia się wiedzą i rozwijania możliwości w życiu zawodowym  korzystając ze wsparcia doświadczonych mentorów. W każdej poprzedniej edycji wzięło udział około 50 uczestniczek z całego świata. Trzecia edycja będzie wyglądała podobnie  każda z uczestniczek będzie mogła współpracować z jednym  wybranym mentorem w czasie indywidualnych sesji mentorskich. Częstotliwość i rodzaj spotkań – online/offline jest ustalana indywidualnie przez mentora i mentee  w zależności od potrzeb. W gronie mentorów pojawią się eksperci związani m.in. z programowaniem w różnych językach i różnymi technologiami  User Experience  sprzedaży  planowania i rozwoju biznesu  finansowania startupów  komercjalizacji badań naukowych  zarządzaniem zespołami  budowaniem wizerunku  czy marketingu. Chciałybyśmy pomóc i rozwinąć jak największą liczbę osób  dlatego piszemy do Waszego koła naukowego. Nasze programy dają szansę na rozwój  zdobycie wiedzy i rozwiązanie konkretnych problemów. Czy pomożecie nam i podzielicie się informacjami w Waszym kole/ na Facebooku/ uczelni? Może ktoś z koła zechciałby wziąć udział w powyższych programach?,
1,"Certyfikat ""Przedsiębiorstwo Przyszłości"" - wyróżniamy najlepszych! IV edycja Konkursu dla firm - nabór do 21 kwietnia 2017 roku Do 21 kwietnia 2017 roku trwa nabór zgłoszeń do IV edycji Ogólnopolskiego Konkursu i Programu Certyfikacji Firm ""Przedsiębiorstwo Przyszłości"". Do udziału w Programie zapraszamy przedsiębiorstwa wszystkich branż  które chcą uzyskać jeden z najbardziej prestiżowych i rozpoznawalnych certyfikatów jakości na polskim rynku. Dodatkowe informacje na http://dxt.net.pl/link.php?M=2814161&N=114&L=76&F=H Prestiż i wizerunek Zdobycie certyfikatu ""Przedsiębiorstwo Przyszłości"" pomaga budować markę  zwiększać przewagę konkurencyjną i pozyskiwać nowych klientów. W dotychczasowych edycjach Programu naszym znakiem jakości wyróżniliśmy m.in. takie firmy jak Polskie Koleje Państwowe S.A.  Centrum Słuchu i Mowy Sp. z o.o. czy Viessmann Sp. z o. o. Dołącz do grona najnowocześniejszych polskich firm i zdobądź certyfikat Przedsiębiorstwo Przyszłości. CZEKAMY NA TWOJĄ FIRMĘ DO 21 KWIETNIA 2017! O Konkursie ""Przedsiębiorstwo Przyszłości"" to Ogólnopolski Program  w którym oferujemy usługę certyfikacji firm cechujących się nowoczesnością  innowacyjnością i nowatorskim podejściem do prowadzenia biznesu. Od 2013 roku prestiżowe certyfikaty ""Przedsiębiorstwo Przyszłości"" zdobywają corocznie liderzy rynku firmy  które osiągnęły sukces dlatego  że są otwarte na wiedzę  kreatywne  inwestują w swoich pracowników  rozumieją  jak ważne jest ciągłe podnoszenie kompetencji i nowoczesne zarządzanie kapitałem ludzkim. Program ""Przedsiębiorstwo Przyszłości"" ma charakter otwarty - może do niego przystąpić każda zainteresowana firma. Zdobywców certyfikatu wyłania specjalna Komisja  w której zasiadają profesorowie i doktorzy renomowanych polskich uczelni  m.in. Uniwersytetu Ekonomicznego w Katowicach  Uniwersytetu Śląskiego i Katolickiego Uniwersytetu Lubelskiego. Wyniki tegorocznej  IV edycji Programu Przedsiębiorstwo Przyszłości ogłosimy jesienią 2017 roku podczas Gali Finałowej na Uniwersytecie Jagiellońskim w Krakowie. Dla kogo? W Programie ""Przedsiębiorstwo Przyszłości"" mogą wziąć udział firmy różnych branż  bez względu na wielkość i status prawny (spółki prawa handlowego  spółki cywilne  osoby fizyczne prowadzące działalność gospodarczą itd.). Szansę na Certyfikat mają firmy  które na pierwszym miejscu stawiają wysoką jakość  a ponadto: dbają o rozwój pracowników  inwestują w wiedzę (szkolenia  kursy  zatrudnianie wysoko wykwalifikowanej kadry)  myślą przyszłościowo  są odpowiedzialne społecznie. ",
0,Hej! Jestem na pierwszym roku informatyki  chętnie pomogę przy oprowadzaniu ludzi na dniu otwartym. Zajęć wtedy nie mam więc nawet zwolnienie nie będzie mi potrzebne.,
1,Szanowni Państwo  Bardzo proszę o opublikowanie poniższej wiadomości na Państwa stronie Internetowej oraz na profilu na Facebooku i poinformowanie studentów o trwającej rekrutacji do Programów Rozwojowych oraz Programu Praktyk Letnich w Citi. Unlock your potential in Citi Śledzisz na bieżąco świat nowych technologii? Chciałbyś  aby w przyszłości określano Cię mianem eksperta w zakresie infrastruktury teleinformatycznej? Masz aspiracje do pełnienia funkcji kierowniczych? Dobrze się składa  ponieważ ruszył nabór do Globalnego Programu Rozwojowego w IT w Citi Service Center Poland. Weź udział w 18-miesięcznym Globalnym Programie Rozwojowym w IT  podczas którego będziesz miał szansę odbyć rotacje w obszarach takich jak: zarządzanie projektami  zarządzanie infrastrukturą technologiczną  wsparcie usług głosowych i sieciowych itp.. Program dostarczy Ci szerokiego spektrum możliwości do praktycznego wykorzystania wiedzy  którą zdobyłeś na studiach. Ponadto otrzymasz dostęp do najnowocześniejszych technologii i infrastruktury  globalnych narzędzi szkoleniowych oraz nieustanne wsparcie ekspertów  którzy pomogą Ci obrać najodpowiedniejszą ścieżkę kariery. Twoje szanse na zostanie jedną z pięciu osób  które wezmą udział w Globalnym Programie Rozwojowym w IT są naprawdę duże  jeśli: jesteś studentem ostatnich lat studiów lub absolwentem kierunków biznesowych  informatycznych i ekonomicznych  interesujesz się zagadnieniami z obszaru IT oraz płynnie posługujesz się językiem angielskim. ,
