1, Dzień dobry Chciałabym zwrócić się do studentów będących członkami koła z zaproszeniem do udziału w Ericsson Summer School – bezpłatnym wakacyjnym kursie programowania w języku C++. Będę bardzo wdzięczna za rozpowszechnienie tej informacji wśród studentów zrzeszonych w kole. Poniżej znajdą Państwo pełną informację na temat rekrutacji na kurs natomiast w załączeniu grafikę do ewentualnego wykorzystania (np. na profilu FB czy stronie www). Z góry dziękuję! W przypadku pytań zachęcam do kontaktu. Pozdrawiam Paulina Biedrońska Ericsson Summer School 2017 Ericsson zaprasza do udziału w Ericsson Summer School – bezpłatnym intensywnym kursie programowania łączącym teoretyczne wykłady z praktycznymi ćwiczeniami domowymi. W kursie mogą wziąć udział wszyscy studenci kierunków technicznych chcący rozwijać swoje umiejętności programistyczne w języku C++. Kurs przewiduje 2 spotkania w tygodniu po 2 5 godziny każde (łącznie 9 spotkań) w godz. 16:30-19:00. Zajęcia odbywać się będą w siedzibie firmy we wtorki i w czwartki w okresie: 03.07.2017 – 04.08.2017. Zorganizowane zostaną 3 grupy warsztatowe na poziomach: podstawowym średniozaawansowanym oraz zaawansowanym. Aby zgłosić swoją chęć udziału w Ericsson Summer School wystarczy do 18.06.2017 zarejestrować się i rozwiązać test na podstawie którego kandydat jest kwalifikowany do grupy osób o podobnym poziomie wiedzy. Wynik testu nie decyduje o przyjęciu a jedynie o przypisaniu do odpowiedniej grupy. Przy wyborze uczestników brany jest też pod uwagę kierunek i rok studiów. Wszystkie informacje dotyczące Ericsson Summer School oraz formularz rejestracyjny można znaleźć na stronie: https://ericssoncareerspoland.typeform.com/to/NMoxhO Zapraszamy! Zespół Ericsson,
1, Dzień dobry Bank BGŻ BNP Paribas organizuje w tym roku trzy bardzo ciekawe programy studenckie: ambasadorski praktyk oraz stażowy. W załączeniu przesyłam więcej informacji na ten temat z prośbą o udostępnienie ich na Państwa portalach społecznościowych lub przez mailing do członków Państwa organizacji. Zależy nam na dotarciu do jak największej liczby studentów dlatego Państwa pomoc będzie nieoceniona J Pozdrawiam ,
0, Cześć wysłałem przed momentem przypadkiem niegotowego maila uzupełniam: Należałem kiedyś do kilku sekcji BITu (IF PZ Algo Plus) ale nigdy formalnie nie zrezygnowałem z członkostwa. W związku z tym cały czas mam dostęp do kilku (konkretnie 111) repozytoriów BITu na Bitbucket. Jestem przekonany że nie będę z tego dostępu korzystał a nieco utrudnia mi to nawigowanie po projektach. Co mogę zrobić w kierunku wypisania się z nich i przede wszystkim przyszłych projektów? Pozdrawiam Mateusz Paciorek ,
1, Dzień dobry Już jutro 6.06.2017 Bank BGŻ BNP Paribas organizuje Wirtualny Dzień Otwarty podczas którego studenci będą mieli okazję porozmawiać ze specjalistami oraz odbyć wirtualny spacer po warszawskim i krakowskim oddziale banku. Chcielibyśmy dotrzeć do szerokiego grona studentów będziemy zatem wdzięczni za udostępnienie informacji na portalach społecznościowych bądź przez mailing do członków Państwa organizacji. W załączniku przesyłam grafikę oraz tekst których możecie Państwo użyć do Social Mediów bądź mailingu do studentów.,
1," Dzień Dobry! Mamy przyjemność zaprosić Państwa do udziału w interdyscyplinarnej konferencji naukowo-technicznej w mocno rozwiniętym obszarze nauki jakim jest rozszerzona i wirtualna rzeczywistość. Według niektórych ekspertów jesteśmy świadkami gwałtownego rozwoju tak jak to miało miejsce na przykład w nanotechnologii. Rynek w ujęciu rocznym w roku 2015 był warty 1 1 miliardów dolarów w 2017 roku wynosi 5 2 miliardów dolarów zaś w roku 2019 ma sięgnąć 14 miliardów dolarów. Stąd przeznacza się duże nakłady na inwestycje wdrożenia technologie patenty i publikacje. Postęp sprzętowy oraz oprogramowanie umożliwia coraz to szersze zastosowania tej techniki w takich działaniach jak: - leczenie fobii oparzeń zespołu pourazowego rehabilitacji w sporcie a także uśmierzenie bólu - interaktywnej edukacji szkoleń symulatory maszyn i pojazdów - architektura i wystrój wnętrz - modelowanie molekularne bioinformatyka symulacje reakcji chemicznych - wsparcie informacyjne decyzji (wyświetlacz przezierny) - geografia i kartografia - technologie wojskowe - prototypownie oraz sztuka film gry rozrywka. Więcej informacji na: http://360inlive.com IV Ogólnopolska Konferencja Naukowa ""Postępy Techniki"" wraz z warsztatami Temat przewodni: Rozszerzona i Wirtualna Rzeczywistość Wrocław 8 czerwca 2017",
0,  Hello Google Play Developer We're writing to let you know about a recent update to our Developer Policy Center. We make updates from time to time as part of a continuous effort to make Google Play a positive experience for both developers and consumers. With this policy update we’re bringing to your attention new requirements on data protection under the EU-U.S. and Swiss-U.S. Privacy Shield frameworks. Please review this update and make sure your app complies with these requirements. Any new apps or app updates published after this notification will immediately be subject to the latest version of the Developer Program Policies. If you find any existing apps in your catalog that don’t comply you'll need to fix and resubmit the app or unpublish it within 30 days.,
0, We’ve just launched Argo a new product that improves the way traffic is routed across the Internet. 35% Estimated improvement for knbit.edu.pl 12 minutes Time saved over 10 000 visitor requests By analyzing routes taken by visitors to knbit.edu.pl we’ve determined Argo Smart Routing delivers a significant reduction in latency for your domain. You can start seeing these performance improvements starting at only $5 per month for knbit.edu.pl.,
0, Cześć Planujemy się wybrać na hackaton(projekt Palantir) pozdrawiam Wojtek OdpowiedzOdpowiedz wszystkimPrześlij dalejEdytuj jako nowa ,
1, Hej cześć i czołem! Jako Fundacja dla AGH wspólnie z Krakowskim Festiwalem Filmowym organizujemy Docs+Science czyli pokaz filmów (a raczej dokumentów) związanych z szeroko pojętą nauką! Myślę że poniższy film może Was zainteresować. Oprócz niego wyświetlimy jeszcze 9 innych :) Kinematografia dostarcza nam wielu przykładów robotów tworzonych na miarę ludzi. Film pt. Maszyna ludzkich marzeń (https://goo.gl/9OisHX) pokazuje że w prawdziwy świecie jesteśmy już o krok od stworzenia sztucznej inteligencji. Ten konkretny film wyświetlany będzie 30.05 | 18:00 - sala 0.10A i 02.06 | 20:00- sala 0.10B. Podrzućcie tę informację dla swoich członków proszę. Może ktoś znajdzie czas i wpadnie ze znajomymi na któryś z pokazów ,) Więcej informacji na wydarzeniu! https://www.facebook.com/events/764247917068279/
1," Dzień dobry Chciałabym zaproponować Studentom którzy jeszcze nie zdobyli wyższego wykształcenia (a więc są przed obroną licencjatu) coś bardzo atrakcyjnego. Świetnie by było gdyby Wasze Koło Naukowe weszło z nami we współpracę i rozpowszechniło poniższe informacje wśród braci studenckiej bo szkoda by było z tego nie skorzystać! Mają Państwo pewnie możliwość komunikowania się ze Studentami poprzez maile facebook czy swoją stronę - myślę że każda forma rozdystrybuowania poniższych informacji będzie pożądana. Co to takiego? Centrum Językowe EVEREST organizuje dofinansowane z UE aż w 87% szkolenia z języka angielskiego i niemieckiego w ramach projektu Kierunek Kariera (projekt realizowany przez WUP Kraków). Wkład własny wynosi jedynie 13% tak więc u nas jest możliwość ukończenia kursu już od 195zł (poniżej szczegóły odnośnie cen i ilości godzin). W cenie wliczony jest prestiżowy i globalnie respektowany w środowisku pracy egzamin TOEIC (z j. angielskiego) albo egzamin WiDaF (z j. niemieckiego) materiały szkoleniowe a także Bilans Kariery – spotkanie z doradcą zawodowym podczas którego każdy pozna swoje mocne strony i stworzy portfolio będące wskazaniem kierunku rozwoju ścieżki zawodowej. Dofinansowanie wydawane jest w formie bonów szkoleniowych (1 bon = 1 godzina lekcyjna = max. 15 zł). Każdy uczestnik w ramach projektu ma do wykorzystania 180 bonów o wartości maksymalnej 2700zł. Wszelkie informacje o projekcie i szkoleniach: www.facebook.com/everestkierunekkariera/ oraz www.everest.edu.pl/bony-szkoleniowe/ Wiem że facebook Waszego Koła prężnie działa dlatego zachęcam do wzajemnego ""fejsbukowego"" wsparcia i śledzenia poczynań CJ Everest na profilu fb poświęconym projektowi (link powyżej). Dla kogo? Osoby pracujące lub prowadzące jednoosobową działalność gospodarczą lecz niezatrudniające pracowników które: - mają pomiędzy 18 a 50 rokiem życia i co najwyżej średnie wykształcenie - maja ukończone 50 lat i dowolne wykształcenie - mieszkają pracują lub uczą się w Małopolsce Co? Proponujemy różne typy kursów (w cenę każdego wliczony jest certyfikowany egzamin materiały szkoleniowe oraz Bilans Kariery): 1. standardowe - spotkania 2 x w tygodniu po 90 min godziny poranne lub wieczorne a/ 60 godz lekcyjnych + certyfikat z egzaminu TOEIC lub WiDaF cena 195 zł b/ 112 godz lekcyjnych + certyfikat z egzaminu TOEIC lub WiDaF cena 218 zł c/ 140 godz lekcyjnych + certyfikat z egzaminu TOEIC lub WiDaF cena 351 zł 2. intensywne wakacyjne - 60 godz lekcyjnych spotkania od poniedziałku do czwartku po 4 godziny lekcyjne w godzinach popołudniowo-wieczornych – sesja lipcowa i sierpniowa Jak skorzystać z dofinansowania? Aby się zgłosić do projektu i skorzystać z bonów szkoleniowych należy przejść kilka prostych kroków w czym zawsze służymy pomocą: 1. Pobierz i wypełnij formularz a następnie złóż go w WUP 2. Po weryfikacji Twojego formularza przystąp do Bilansu Kariery - spotkania z doradcą zawodowym 3. Zarejestruj się w Bazie Usług Rozwojowych (BUR) 4. Podpisz umowę z WUP 4. Zamów bony (wystarczy wypełnić i wysłać mailowo formularz) i wpłać 13% wkładu własnego 5. Zapisz się na nasz kurs językowy w Bazie Usług Rozwojowych i odwiedź nas w CJ EVEREST 6. Ucz się z nami 7. Oceń nasze szkolenie w Bazie Usług Rozwojowych W razie pytań proszę o kontakt z chęcią odpowiem na wszelkie pytania. Byłabym wdzięczna za jakąkolwiek informację zwrotną.",
0, Hello Your certificate (or certificates) for the names listed below will expire in 9 days (on 02 Jun 17 21:25 +0000). Please make sure to renew your certificate before then or visitors to your website will encounter errors. chat.iiet.pl forum.iiet.pl git.iiet.pl iiet.pl obieraki.iiet.pl tex.iiet.pl wiki.iiet.pl For any questions or support please visit https://community.letsencrypt.org/. Unfortunately we can't provide support by email. For details about when we send these emails please visit https://letsencrypt.org/docs/expiration-emails/. In particular note that this reminder email is still sent if you've obtained a slightly different certificate by adding or removing names. If you've replaced this certificate with a newer one that covers more or fewer names than the list above you may be able to ignore this message. ,
1,  Szanowni Państwo Piszę w imieniu Stowarzyszenia WIOSNA znanego z takich projektów jak SZLACHETNA PACZKA i AKADEMIA PRZYSZŁOŚCI. Chcielibyśmy serdeczne zaprosić Państwa Koło Naukowe do współpracy w realizacji nowego projektu rynku pracy – „AKTYWNI POTRZEBNI KOMPETENTNI - KOMPLEKSOWY PROGRAM AKTYWIZACJI ZAWODOWEJ OSÓBNIEPEŁNOSPRAWNYCH 30+ W MAŁOPOLSCE” Poszukujemy wolontariuszy z dziedziny informatyki którzy chcieliby podzielić się swoją wiedzą czasem i doświadczeniem z osobami nieaktywnymi zawodowo udzielając im porad które będą stanowić wsparcie w przezwyciężaniu trudnej sytuacji na rynku pracy i odkrywaniu ich potencjału. Aktualnie dla kilku Uczestników poszukuję osób które mogłyby wesprzeć naszych Uczestników w opanowaniu podstaw obsługi komputera internetu i programów pakietu office. Podjęcie współpracy w roli wolontariusza-eksperta w projekcie 30+ to szansa na zaangażowanie w naprawdę szczytny cel możliwość wpływu na zmiany w życiu konkretnych osób z terenu Małopolski a także współtworzenie społeczności WIOSNY i przynależność do grupy wartościowych i aktywnych ludzi. Szczegółowe informacje i formularz zgłoszenia są dostępne są na stronie projektu w zakładce „zostań wolontariuszem”: http://rynekpracy.wiosna.org.pl/aktywni/ oraz w załączniku do niniejszego maila. Serdecznie zapraszamy do współpracy i będziemy wdzięczni za przekazanie informacji o naszych działaniach do wszystkich zainteresowanych studentów. Z wyrazami szacunku ,
1, Dzień dobry Szanowni Państwo przesyłam zaproszenie do udziału w 24-godzinnym hackathonie Oriental Eovation który odbędzie się 26-27 maja w Gdańsku. Będę wdzięczny za przekazanie informacji dla studentów mailowo lub przez social media. Wydarzenie dedykowane jest dla osób które chcą tworzyć rozwiązania będące odpowiedzią na zmiany klimatyczne zachodzące w świecie. Hackaton ma zachęcić i zaktywizować studentów startupy oraz ludzi biznesu do działania i tworzenia rozwiązań wyzwań społecznych oraz biznesowych poświęconych zmianom klimatu. W ramach EoVation uczestnicy pracując w zespołach będą mieli 24 godziny na zaproponowanie rozwiązania na jeden z przedstawionych problemów zaprojektowanie konceptu jego działania oraz przedstawienia pomysłu przed jury. Na najlepsze zepsoły czekają atrakcyjne nagrody. Dziękuję i Pozdrawiam Bogdan Zhukevych ᐧ ,
1, Dzień dobry Jesteśmy grupą studentów uczelni artystycznych którzy prowadzą małą firmą świadczącą usługi audiowizualne. Oferujemy streamingi oraz realizacje wielokamerowe po bardzo atrakcyjnej cenie. Współpracujemy z wieloma instytucjami m.in AGH w Krakowie Teatr Odwrócony Klub Zet Pe Te i wiele innych. Oprócz transmisji live i nagrań zajmujemy się również oprawą wizualną imprez (oświetlenie wizualizacje dekoracja) oraz realizacjami filmowymi. Posiadamy duże zaplecze sprzętowe. W razie zapotrzebowania na tego typu usługi zapraszamy do kontaktu! pozdrawiam serdecznie Przemysław Kopacz,
1, Witam Kontaktuję się w imieniu internetowego biura tłumaczeń. Segment tłumaczeń technicznych wymagający jest specjalistycznego nazewnictwa znajomości tematyki oraz starannie dopracowanego warsztatu translatorskiego. Przekłady tego rodzaju powierzamy doświadczonemu zespołowi tłumaczy oraz osobom prowadzących projekty tłumaczeniowe z uprawnieniami Naczelnej Organizacji Technicznej (NOT) którzy ekspresowo zajmują się tłumaczeniem dokumentów technicznych instrukcji obsługi maszyn oraz katalogów produktowych. W ponad 50 językach obejmujących 102 pary językowe przeprowadzamy złożone projekty stosując specyficzną branżową terminologię. Zapewniamy odwzorowanie edycyjne formatowanie i zgodność pliku z tłumaczeniem z dokumentem źródłowym. Dbamy o precyzyjne wykonanie tłumaczenia fachowość i przejrzystość oraz dostosowanie treści do specjalistycznej wiedzy odbiorcy. Stosujemy najnowsze rozwiązania branży tłumaczeniowej z integracją narzędzi CAT z naszym serwisem co w rezultacie wspomaga i przyspiesza proces przekładu i dzięki temu w wycenach eliminujemy powtórzenia i cyfry. ,
0, Kacper Lalasz chce pozostać w kontakcie na LinkedIn. Kacper Lalasz Kacper Lalasz Intern in Schlumberger Szwajcaria Potwierdź że znasz użytkownika Kacper Lalasz Zrezygnuj | Pomoc Otrzymujesz wiadomości e-mail Zaproszenie. Linkedin wykorzysta Twój adres e-mail aby wysłać sugestie swoim członkom przez funkcje takie jak Osoby które możesz znać. Ta wiadomość e-mail została wysłana na adres oferta@knbit.edu.pl. LinkedIn © 2017 LinkedIn Ireland Unlimited Company Wilton Plaza Wilton Place Dublin 2. LinkedIn jest oficjalną nazwą firmy LinkedIn Ireland Unlimited Company. LinkedIn i logo LinkedIn są zarejestrowanymi znakami handlowymi firmy LinkedIn.,
0," Witam Kontaktuję się w imieniu internetowego biura tłumaczeń. Segment tłumaczeń technicznych wymagający jest specjalistycznego nazewnictwa znajomości tematyki oraz starannie dopracowanego warsztatu translatorskiego. Przekłady tego rodzaju powierzamy doświadczonemu zespołowi tłumaczy oraz osobom prowadzących projekty tłumaczeniowe z uprawnieniami Naczelnej Organizacji Technicznej (NOT) którzy ekspresowo zajmują się tłumaczeniem dokumentów technicznych instrukcji obsługi maszyn oraz katalogów produktowych. W ponad 50 językach obejmujących 102 pary językowe przeprowadzamy złożone projekty stosując specyficzną branżową terminologię. Zapewniamy odwzorowanie edycyjne formatowanie i zgodność pliku z tłumaczeniem z dokumentem źródłowym. Dbamy o precyzyjne wykonanie tłumaczenia fachowość i przejrzystość oraz dostosowanie treści do specjalistycznej wiedzy odbiorcy. Stosujemy najnowsze rozwiązania branży tłumaczeniowej z integracją narzędzi CAT z naszym serwisem co w rezultacie wspomaga i przyspiesza proces przekładu i dzięki temu w wycenach eliminujemy powtórzenia i cyfry. ""Hej Wybacz za późną odpowiedź - dużo się dziąło ostatnio. generalnie - działamy :) Możemy porozmawiać telefonicznie ? Mój nr: 691 369 260 ",
1, Dzień dobry/ Cześć! Bardzo serdecznie zapraszamy na szkolenie z programu MS Excel! Ostatni przedwakacyjny kurs w cenie 250 zł/poziom. POZIOM ŚREDNIOZAAWANSOWANY - 20-21.05.2017r POZIOM ZAAWANSOWANY - 27-28.05.2017r OPIS SZKOLEŃ i WSZYSTKIE INFORMACJE: https://www.facebook.com/events/1290423471075773/ Szkolenie jest certyfikowane prowadzi je Pan Marek Krawczyk - firma COMart SK. Czas trwania szkolenia to 16 h (sobota + niedziela). Będziemy wdzięczni za udostępnienie informacji w obrębie Koła i zachęcamy do zapisów. ,
0, Witam Miałbym kilka pytań dotyczących możliwości współpracy z Waszym Kołem. Czy można prosić o numer kontaktowy to przewodniczącego? ,
1, Szanowni Państwo serdecznie zapraszam do przedstawienia dokonań Państwa organizacji / kół naukowych podczas konkursu prezentacji „Forum Młodych Mistrzów” w ramach Forum Teleinformatyki. Termin na zgłaszanie został wydłużony stąd proszę zignorować wyświetlane informacje o terminie 30.04.2017. · 1 etap – przesłanie prezentacji multimedialnej za pomocą formularza: rejestracja.forumti.pl/prezentacja · 2 etap – finał (wybrane prezentacje) przedstawienie podczas Forum Teleinformatyki. Do zdobycie cenne nagrody w kilku kategoriach oraz możliwość darmowego uczestnictwa w Forum Teleinformatyki podczas którego omawiane są zagadnienia związanie z informatyzacją RP.,
0, Dzień dobry doszły mnie słuchy że studenci wybierają się na mistrzostwa. W przypadku studentów Kierunku Informatyka wnioski wyjazdowe przygotowuję ja więc proszę o kontakt w tej sprawie. Najlepiej jeśli wzorem ubiegłych lat będzie jeden przedstawiciel grupy. Bardzo proszę o zajęcie się sprawą na co najmniej dwa tygodnie przed wyjazdem. pozdrawiam Monika Czekierda ,
0,Take control and block malicious traffic Rate Limiting protects against brute force login attacks  API endpoint abuse  and sophisticated layer 7 DDoS attacks. Enable Rate Limiting for Free Rate Limiting is available for free for your first 10 000 requests per month. Enable Rate Limiting today.,
1,Szanowni Państwo  Zachęcamy do poinformowania studentów o GSA Hackathonie  który odbędzie się 15/16-17 maja w Trójmieście. Przykładowy tekst do udostępnienia: 15-17 maja w Trójmieście odbędzie się Galileo Hackathon organizowany przez Agencję Europejskiego GNSS (GSA). Poszukiwani są entuzjastycznie nastawieni programiści  którzy interesują się usługami lokalizacyjnymi (LBS)  technologiami geoprzestrzennymi i internetem rzeczy (IoT). Uczestnicy mogą liczyć na networking ze społecznością programistyczną  1000 Euro nagrody oraz dostęp do najnowszego smartfona Samsunga  który nie tylko jest gotowy na śledzenie Galileo  ale także daje deweloperom aplikacji dostęp do surowych obserwacji GNSS. 28 kwietnia o godz. 13:00 odbędzie się również webinarium wyjaśniaje zasady udziału w wydarzeniu https://www.gsa.europa.eu/gnss-raw-measurements-location-based-apps-webinar Więcej informacji na: http://kosmonauta.net/2017/03/galileo-hackathon-otwarta-rejestracja/ oraz https://www.gsa.europa.eu/galileo_hackathon_2017 ,
1,Dzień dobry  Chciałabym zaprosić Was do udziału w Dniu Otwartym w firmie Ericsson  który odbędzie się w dwóch terminach – 18.05. i 25.05. Dodatkowo prosiłabym o rozpowszechnienie tej informacji wśród studentów Waszej uczelni. Będę wdzięczna za udostępnienie informacji na Waszych profilach w mediach społecznościowych  przekazywania informacji na zebraniach  spotkaniach oraz informowania studentów w każdy inny sposób  jaki przyjdzie Wam do głowy. Poniżej podaję propozycję treści postu  a w załączeniu znajdziecie grafikę do wykorzystania. Gdybyście mieli jakieś pytania  chętnie na nie odpowiem. Z góry dziękuję.,
1,Szanowni Państwo  Serdecznie zapraszamy Państwa do udziału w konferencji VII Forum Przedsiębiorców Małopolski Dziennika Polskiego pn. „Myślę  więc jestem przedsiębiorcą. Biznes dla nauki  nauka dla biznesu. Jak podbić region  Polskę  Europę  świat” która odbędzie się 24 maja 2017 r.  w Międzynarodowym Centrum Targowo-Kongresowym EXPO Kraków  ul. Galicyjska 9. Spotkanie rozpoczyna się o godzinie 9:00. W konferencji swój udział potwierdzili: Jarosław Gowin - Wicepremier  Minister Nauki i Szkolnictwa Wyższego Piotr Dardziński - Wiceminister Nauki i Szkolnictwa Wyższego Jadwiga Emilewicz - Wiceminister Rozwoju Jacek Krupa – Marszałek Województwa Małopolskiego Wśród tematów spotkania znajdą się: Od gospodarki opartej na niskich kosztach pracy do gospodarki zarabiającej na wiedzy Jak podnieść wartość firmy i zwiększyć jej szanse na rynku Jak otworzyć naukę na potrzeby biznesu  jak zarazić innowacjami polskich przedsiębiorców Jak zarabiać na dobrych pomysłach: komercjalizacja wynalazków i innowacji Ulgi  uproszczenia  ułatwienia dla firm: przyjazne prawo  przyjaźni urzędnicy Innowacyjna marka „Polska”: jak przełożyć indywidualny sukces firm na sukces kraju. Spotkanie poprowadzi redaktor Zbigniew Bartuś. Mamy do rozdysponowania pulę darmowych zaproszeń dla studentów  którzy chcieliby wziąć udział w konferencji. Decyduje kolejność zgłoszeń. Na zgłoszenia czekamy do 15 maja 2017 r. ,
0,Dzień dobry  jak wygląda sytuacja? Czy udało się znaleźć ochotników do pomocy w Festiwalu Nauki? Pozdrawiam,
0,Szanowni Państwo  kontaktuję się z Państwem w sprawie możliwości pozycjonowania serwisu knbit.edu.pl w wyszukiwarce google. Do dziś zaufało nam wiele firm i przy naszej pomocy zwiększyło zyski ze swojej strony internetowej  co potwierdzają nasze referencje - http://www.topsolutions.pl/referencje Naszymi atutami są: - etyczne metody pozycjonowania  - wieloletnie doświadczenie w pozycjonowaniu stron  poparte referencjami  - solidny zespół doświadczonych specjalistów  - prosta i czytelna umowa  zawierana na czas nieokreślony  - konkurencyjne ceny. Zgodnie z ustawą o świadczeniu usług drogą elektroniczną (z dnia 18.07.2002 Dz. Nr 144 poz.1204) zwracam się z prośbą o wyrażenie zgody na przesłanie oferty. Aby otrzymać propozycję pozycjonowania  proszę Państwa o odpisanie na powyższy e-mail  podając swoje dane kontaktowe i numer telefonu. Państwa e-mail znalazłem w ogólnodostępnych źródłach w Internecie. Jeśli nie jesteście Państwo zainteresowani również proszę o informację. ,
1,Cześć! Serdecznie zapraszamy na pierwsze spotkanie z cyklu Warsztatów z GNU Emacs! Jednocześnie prosimy o rozprzestrzenienie wśród Waszych członków informacji na temat naszych warsztatów :) W czasie cyklicznych spotkań będzie można się przekonać między innymi: * dlaczego Linus Torvalds (twórca Linuxa)  Mark Zuckerberg czy Guido van Rossum (twórca języka Python) korzystają z Emacsa jako swojego głównego edytora tekstu! * w jaki sposób skonfigurować edytor do swoich wymagań  niekoniecznie jedynie związanych z programowaniem! Koordynaty czasoprzestrzenne: 26 kwietnia 2017  godzina 16.00 Sala 1177  Budynek Wydziału Matematyki i Informatyki Uniwersytetu Jagiellońskiego ul. Łojasiewicza 6 Kraków Mamy nadzieję  że wpadniecie i razem z nami przekonacie się dlaczego warto przesiąść się z Eclipse lub IntelliJ na bardziej 'klasyczną' alternatywę! ;) W razie jakichkolwiek pytań proszę o odpowiedź na tę wiadomość. ,
